<?xml version="1.0" encoding="UTF-8"?>
<!DOCTYPE configuration SYSTEM "dtdHadl.dtd">
<configuration nom="confGlobal" classPath="">

	<contraintes />
	<proprietes />
	
	<composants>
		<composant nom="comp1" classPath="">
			<contraintes />
			<proprietes />
		</composant>
	</composants>
	
	<connecteurs>
	</connecteurs>	
	
	<attachements>
	</attachements>
	
	<bindings>
	</bindings>	
</configuration>














